reference_id,candidate_statement,valid,Remarks
0,willow and birch can be discriminated with down,Valid,"Down is ""fine fur"" as noun, it should be valid but hard to obtain"
2,bison and elephant can be discriminated with herds,Valid,"I think it's okay, some participants even use ""herd"" in the game."
767,pants and jacket can be discriminated with materials,Invalid,
3772,pants and jacket can be discriminated with seams,Invalid,"I think this is invalid, because in my sense both jacket and pants can have seams although not the same style "
5,blouse and dress can be discriminated with buttons,Invalid,
1199,blouse and dress can be discriminated with silk,Invalid,
2350,lamp and mirror can be discriminated with electrical,Valid,
1960,lamp and mirror can be discriminated with lightbulbs,Valid,
7,lamp and mirror can be discriminated with cord,Valid,
1472,rabbit and squirrel can be discriminated with ears,Valid,
9,fridge and stove can be discriminated with shelves,Valid,
86,fridge and stove can be discriminated with rectangular,Invalid,
10,leopard and cougar can be discriminated with spots,Valid,
3610,onions and tomato can be discriminated with bulbs,Valid,
13,lime and coconut can be discriminated with seeds,Valid,
684,elephant and camel can be discriminated with tusks,Valid,
783,elephant and camel can be discriminated with peanuts,Valid,
15,elephant and zebra can be discriminated with ears,Valid,
3310,elephant and zebra can be discriminated with trunk,Valid,
3516,thermometer and tray can be discriminated with mercury,Valid,
1433,coat and socks can be discriminated with zipper,Valid,
18,coat and socks can be discriminated with pockets,Valid,
3268,coat and socks can be discriminated with hood,Valid,
19,ant and beetle can be discriminated with bites,Valid,
20,bagpipe and tuba can be discriminated with plaid,Valid,
1707,pants and shoes can be discriminated with zippers,Invalid,"I think this is invalid, because in my sense both shoes and pants can have zippers although not the same style (pants may have longer zippers)"
21,pants and shoes can be discriminated with loops,Valid,
923,pants and shoes can be discriminated with pockets,Valid,
332,trout and squid can be discriminated with scales,Valid,
22,trout and squid can be discriminated with gills,Valid,
808,cupboard and oven can be discriminated with handles,Invalid,
3747,cougar and caribou can be discriminated with claws,Valid,
28,microwave and fridge can be discriminated with turntable,Valid,
31,moth and beetle can be discriminated with grey,Valid,
2169,rattlesnake and iguana can be discriminated with slender,Valid,
1867,rattlesnake and iguana can be discriminated with bites,Valid,
3671,rattlesnake and iguana can be discriminated with rodents,Valid,
2515,plug and hose can be discriminated with prongs,Valid,
2916,plug and hose can be discriminated with cord,Valid,
1976,orange and lemon can be discriminated with sections,Invalid,
361,shoes and jeans can be discriminated with heels,Valid,
39,shoes and jeans can be discriminated with sizes,Invalid,"emmm, it's confusing, it should be invalid"
1121,shoes and jeans can be discriminated with soles,Valid,
40,lime and garlic can be discriminated with seeds,Valid,
3144,raft and sailboat can be discriminated with rubber,Valid,
42,raft and sailboat can be discriminated with square,Invalid,
770,shoes and socks can be discriminated with sizes,Invalid,"emmm, it's confusing, it should be invalid"
680,shoes and socks can be discriminated with suede,Valid,
958,shoes and socks can be discriminated with laces,Valid,
47,orange and peach can be discriminated with pulp,Valid,
1732,orange and peach can be discriminated with sections,Valid,
1135,saxophone and harmonica can be discriminated with mouthpiece,Valid,"They did have difference, I think it's valid (although it may be too specific)"
3508,jeans and boots can be discriminated with buttons,Valid,
446,jeans and boots can be discriminated with zipper,Invalid,
49,jeans and boots can be discriminated with fades,Valid,
50,saucer and tray can be discriminated with porcelain,Invalid,
2830,saucer and tray can be discriminated with patterns,Invalid,
1407,saxophone and harpsichord can be discriminated with gold,Valid,
1127,saxophone and harpsichord can be discriminated with reeds,Valid,
56,tank and rifle can be discriminated with tracks,Valid,
1298,tank and rifle can be discriminated with guns,Valid,
58,squid and trout can be discriminated with ink,Valid,
61,tray and fridge can be discriminated with round,Invalid,
62,banana and raspberry can be discriminated with long,Valid,
63,wheel and tank can be discriminated with rubber,Valid,"I guess it's because wheel is made up of rubber in general, while metal for tank"
3043,wheel and tank can be discriminated with rims,Valid,
65,bike and skis can be discriminated with frame,Valid,
1155,bike and skis can be discriminated with gears,Valid,
66,deer and bison can be discriminated with antlers,Valid,
2253,pencil and crayon can be discriminated with graphite,Valid,
68,cherry and strawberry can be discriminated with pit,Valid,
70,beans and broccoli can be discriminated with brown,Invalid,"Does it mean beans can be brown, but broccoli can't in general"
72,tomato and celery can be discriminated with seeds,Valid,
1508,guitar and trumpet can be discriminated with wood,Valid,
74,arm and hand can be discriminated with sleeve,Invalid,
76,bed and toilet can be discriminated with sizes,Invalid,
3285,bed and toilet can be discriminated with headboard,Valid,
2188,bed and toilet can be discriminated with mattress,Valid,
387,butterfly and caterpillar can be discriminated with antennae,Valid,
2122,mackerel and crab can be discriminated with gills,Valid,
79,mackerel and crab can be discriminated with scales,Valid,
2512,camel and cow can be discriminated with hump,Valid,
80,camel and cow can be discriminated with beige,Valid,
81,vulture and sparrow can be discriminated with claws,Valid,"I think they have different styles of claws, so it may be valid"
82,eggplant and broccoli can be discriminated with seeds,Valid,
83,falcon and pelican can be discriminated with rodents,Invalid,
2651,mole and mink can be discriminated with holes,Valid,
2406,mole and mink can be discriminated with burrows,Valid,
85,groundhog and raccoon can be discriminated with burrows,Valid,
87,plug and stereo can be discriminated with wires,Valid,"I'm not sure what plug is in your sense, but in my sense plug doesn't have wires while stereo should have"
818,kite and eagle can be discriminated with string,Valid,
89,tuba and flute can be discriminated with gold,Invalid,
90,ship and helicopter can be discriminated with floats,Valid,
91,onions and garlic can be discriminated with layers,Invalid,
2706,spider and worm can be discriminated with insects,Valid,
339,hawk and buzzard can be discriminated with rodents,Valid,
2874,hawk and buzzard can be discriminated with mice,Valid,
96,cottage and barn can be discriminated with fireplace,Invalid,
3906,corn and avocado can be discriminated with stalks,Valid,
98,corn and avocado can be discriminated with ears,Valid,
2870,corn and avocado can be discriminated with husks,Valid,
1903,tray and bucket can be discriminated with square,Invalid,
102,screwdriver and scissors can be discriminated with heads,Valid,
2725,jacket and shirt can be discriminated with hood,Invalid,
2745,jacket and bag can be discriminated with zipper,Invalid,
2946,jacket and bag can be discriminated with sleeves,Valid,
1802,hawk and sparrow can be discriminated with rodents,Valid,
106,hawk and sparrow can be discriminated with mice,Valid,
107,colander and blender can be discriminated with holes,Valid,
3865,sink and fridge can be discriminated with drain,Valid,
109,lips and mouth can be discriminated with tight,Invalid,
2714,catfish and lobster can be discriminated with garbage,Invalid,
112,catfish and lobster can be discriminated with fins,Valid,
114,beaver and squirrel can be discriminated with swims,Valid,
116,camel and crocodile can be discriminated with humps,Valid,
2065,camel and crocodile can be discriminated with spits,Valid,
2223,prune and avocado can be discriminated with purple,Valid,
334,prune and avocado can be discriminated with wrinkled,Valid,
118,sink and toaster can be discriminated with enamel,Valid,
196,sink and toaster can be discriminated with porcelain,Valid,
121,barn and inn can be discriminated with stalls,Valid,
123,cupboard and freezer can be discriminated with shelves,Invalid,
124,mixer and stereo can be discriminated with bowls,Valid,
1756,tank and rocket can be discriminated with guns,Valid,
2982,tank and rocket can be discriminated with tracks,Valid,
1271,bed and carpet can be discriminated with springs,Valid,
126,bed and carpet can be discriminated with spring,Valid,
533,mixer and faucet can be discriminated with electrical,Valid,
3351,mixer and faucet can be discriminated with blades,Valid,
194,falcon and owl can be discriminated with rodents,Invalid,
130,trousers and boots can be discriminated with wool,Valid,
246,coat and skirt can be discriminated with zipper,Invalid,
3461,coat and skirt can be discriminated with sleeves,Valid,
1528,jeans and shirt can be discriminated with fades,Invalid,
132,jeans and shirt can be discriminated with zipper,Valid,
1115,cow and elephant can be discriminated with milk,Valid,
135,tent and hut can be discriminated with poles,Invalid,
137,parakeet and woodpecker can be discriminated with seeds,Invalid,
1032,pants and socks can be discriminated with buttons,Valid,
3323,pants and socks can be discriminated with materials,Valid,
303,pants and socks can be discriminated with seams,Valid,
3385,pants and socks can be discriminated with cuffs,Invalid,"I also think it's weird, can cuffs mean two holes (close to foot)"
140,daughter and girl can be discriminated with parents,Valid,
1460,lemon and coconut can be discriminated with sour,Valid,
143,frog and deer can be discriminated with insects,Valid,
854,bagpipe and banjo can be discriminated with bag,Valid,
145,hare and squirrel can be discriminated with carrots,Valid,
704,hare and squirrel can be discriminated with hops,Valid,
2003,orange and plum can be discriminated with pulp,Valid,
434,cougar and deer can be discriminated with animals,Invalid,
723,stereo and tape can be discriminated with electronic,Valid,
1564,stereo and tape can be discriminated with radio,Valid,
1036,stereo and tape can be discriminated with turntable,Valid,
1565,eggplant and onions can be discriminated with seeds,Valid,
150,actress and girl can be discriminated with act,Invalid,
151,camel and horse can be discriminated with hump,Valid,
2361,camel and horse can be discriminated with beige,Invalid,
2698,snail and rattlesnake can be discriminated with antennae,Valid,
507,spider and cat can be discriminated with flies,Valid,
815,spider and cat can be discriminated with crawls,Valid,
156,grenade and cannon can be discriminated with pin,Valid,
159,lobster and asparagus can be discriminated with claws,Valid,
2740,bag and trousers can be discriminated with handles,Valid,
161,cow and sheep can be discriminated with manure,Valid,
1187,elephant and gorilla can be discriminated with ears,Valid,
2876,elephant and gorilla can be discriminated with trunk,Valid,
166,meat and potatoes can be discriminated with protein,Valid,
167,scissors and spatula can be discriminated with blades,Valid,
1618,piano and guitar can be discriminated with ivory,Valid,
171,hut and tent can be discriminated with grass,Invalid,
3031,snail and cockroach can be discriminated with antennae,Invalid,
173,radio and microwave can be discriminated with dials,Valid,
3167,radio and microwave can be discriminated with antenna,Valid,
1814,elephant and goat can be discriminated with tusks,Valid,
2029,elephant and goat can be discriminated with trunk,Valid,
2161,prune and pear can be discriminated with purple,Valid,
175,prune and pear can be discriminated with pit,Valid,
2496,coat and dress can be discriminated with buttons,Invalid,
3938,coat and dress can be discriminated with materials,Invalid,
177,coat and dress can be discriminated with hood,Valid,
2564,mackerel and shrimp can be discriminated with fins,Valid,
179,leg and arm can be discriminated with long,Valid,
180,crab and tuna can be discriminated with claws,Valid,
185,airplane and helicopter can be discriminated with engines,Invalid,
2077,airplane and helicopter can be discriminated with crashes,Invalid,
186,mother and woman can be discriminated with son,Valid,
188,wheel and bike can be discriminated with spokes,Valid,
3221,wheel and bike can be discriminated with rolls,Invalid,
189,rabbit and cat can be discriminated with carrots,Valid,
2256,rabbit and cat can be discriminated with hops,Valid,
191,spatula and paintbrush can be discriminated with rubber,Valid,
192,stereo and mixer can be discriminated with radio,Valid,
2678,stereo and mixer can be discriminated with turntable,Invalid,
3030,crab and salmon can be discriminated with sideways,Valid,
1018,raccoon and coyote can be discriminated with garbage,Valid,
197,avocado and beans can be discriminated with seeds,Valid,
198,elephant and frog can be discriminated with grey,Valid,
3663,prune and raspberry can be discriminated with wrinkled,Valid,
2096,prune and raspberry can be discriminated with purple,Valid,
2696,banner and umbrella can be discriminated with colourful,Invalid,
202,rope and screws can be discriminated with thin,Valid,
2899,rope and screws can be discriminated with twisted,Valid,
2124,cat and goat can be discriminated with claws,Valid,
2616,cat and goat can be discriminated with paws,Valid,
209,hair and body can be discriminated with keratin,Valid,
359,jeans and gown can be discriminated with buttons,Valid,
210,jeans and gown can be discriminated with denim,Valid,
3882,jeans and gown can be discriminated with fades,Valid,
2931,bed and curtains can be discriminated with sizes,Invalid,
212,bed and curtains can be discriminated with headboard,Valid,
379,bed and curtains can be discriminated with mattress,Valid,
213,snail and wasp can be discriminated with antennae,Valid,
2535,orange and pepper can be discriminated with pulp,Valid,
3833,camel and deer can be discriminated with humps,Valid,
1822,camel and deer can be discriminated with spits,Valid,
216,lobster and tuna can be discriminated with claws,Valid,
1439,hut and cottage can be discriminated with straw,Invalid,
3527,cod and squid can be discriminated with fins,Valid,
2108,plug and bolts can be discriminated with prongs,Valid,
220,plug and bolts can be discriminated with cord,Valid,
474,avocado and broccoli can be discriminated with pit,Valid,
226,horse and cart can be discriminated with hooves,Valid,
228,plum and coconut can be discriminated with purple,Valid,
2677,corn and coconut can be discriminated with stalks,Valid,
231,corn and coconut can be discriminated with ears,Valid,
3728,corn and coconut can be discriminated with husks,Valid,
2676,saxophone and harp can be discriminated with mouthpiece,Valid,
2259,coat and trousers can be discriminated with sleeves,Valid,
2081,coat and trousers can be discriminated with zipper,Invalid,
236,tomato and beans can be discriminated with seeds,Valid,
2304,rope and bolts can be discriminated with braided,Valid,
1761,frog and beetle can be discriminated with tongue,Valid,
240,socks and jacket can be discriminated with holes,Invalid,
583,cherry and pineapple can be discriminated with stem,Valid,
682,cannon and rocket can be discriminated with balls,Valid,
244,eagle and hawk can be discriminated with bald,Valid,
1415,elephant and cow can be discriminated with tusks,Valid,
2325,elephant and cow can be discriminated with peanuts,Valid,
249,faucet and mixer can be discriminated with chrome,Valid,
1375,faucet and mixer can be discriminated with controls,Valid,
2046,prune and cranberry can be discriminated with purple,Valid,
250,prune and cranberry can be discriminated with pit,Valid,
252,bed and door can be discriminated with sizes,Invalid,
994,bed and door can be discriminated with headboard,Valid,
3324,bed and door can be discriminated with mattress,Valid,
3677,canoe and boat can be discriminated with tips,Invalid,I also don't understand what tips mean here
254,pencil and screwdriver can be discriminated with thin,Valid,
754,pencil and screwdriver can be discriminated with eraser,Valid,
256,rattlesnake and crocodile can be discriminated with slithers,Valid,
1994,rattlesnake and crocodile can be discriminated with fangs,Valid,
1264,salmon and chicken can be discriminated with fins,Valid,
2158,spider and beetle can be discriminated with flies,Invalid,
2015,spider and beetle can be discriminated with webs,Valid,
262,skunk and deer can be discriminated with danger,Valid,
2479,sailboat and raft can be discriminated with sails,Valid,
263,sailboat and raft can be discriminated with motor,Invalid,
2371,turtle and squirrel can be discriminated with slowly,Valid,
265,woman and boy can be discriminated with female,Valid,
1746,trousers and dress can be discriminated with buttons,Invalid,
1608,trousers and dress can be discriminated with cuffs,Invalid,"I also think it's weird, can cuffs mean two holes (close to foot)"
2130,kettle and tray can be discriminated with plug,Valid,
3900,kettle and tray can be discriminated with spout,Valid,
3471,tank and hose can be discriminated with guns,Valid,
276,raft and sled can be discriminated with floats,Valid,
2034,raft and sled can be discriminated with square,Invalid,
3137,typewriter and pencil can be discriminated with bell,Valid,
945,typewriter and pencil can be discriminated with letters,Valid,
1602,trumpet and cello can be discriminated with valves,Valid,
2762,camel and sheep can be discriminated with hump,Valid,
1461,camel and sheep can be discriminated with beige,Valid,
608,gate and cottage can be discriminated with latch,Valid,
1655,sack and jacket can be discriminated with cloth,Valid,
283,sack and jacket can be discriminated with burlap,Valid,
2143,balloon and jet can be discriminated with floats,Valid,
1313,balloon and jet can be discriminated with colourful,Valid,
290,tuna and salmon can be discriminated with large,Valid,
292,pot and tray can be discriminated with lid,Valid,
294,fingers and hand can be discriminated with elongated,Valid,
1898,shoes and shirt can be discriminated with heels,Valid,
2640,shoes and shirt can be discriminated with buckles,Valid,
2575,shoes and shirt can be discriminated with soles,Valid,
297,strawberry and banana can be discriminated with seeds,Valid,
2598,saxophone and tuba can be discriminated with reeds,Valid,
2327,frog and tiger can be discriminated with swims,Invalid,
301,girlfriend and girl can be discriminated with lover,Valid,
304,eagle and falcon can be discriminated with bald,Valid,
2369,cat and elephant can be discriminated with mice,Invalid,
1550,trousers and skirt can be discriminated with buttons,Invalid,
2254,trousers and skirt can be discriminated with cuffs,Invalid,"I also think it's weird, can cuffs mean two holes (close to foot)"
307,gate and church can be discriminated with hinges,Valid,
3643,gate and church can be discriminated with latch,Valid,
308,crab and squid can be discriminated with claws,Valid,
3495,elephant and turtle can be discriminated with tusks,Valid,
3392,elephant and turtle can be discriminated with peanuts,Valid,
312,saucer and balloon can be discriminated with china,Valid,
313,gun and barrel can be discriminated with trigger,Valid,
315,bungalow and bedroom can be discriminated with basement,Invalid,
316,tomato and onions can be discriminated with seeds,Valid,
512,kettle and spoon can be discriminated with plug,Valid,
946,frog and cow can be discriminated with swims,Valid,
319,dog and cow can be discriminated with chases,Valid,
3840,paintbrush and screwdriver can be discriminated with sizes,Invalid,
321,seagull and stork can be discriminated with garbage,Invalid,
2264,skirt and gown can be discriminated with materials,Invalid,
1839,skirt and gown can be discriminated with pleats,Valid,
851,octopus and eel can be discriminated with cups,Valid,
373,lemon and garlic can be discriminated with seeds,Valid,
1229,prune and banana can be discriminated with dried,Invalid,
325,prune and banana can be discriminated with seeds,Valid,
1399,prune and banana can be discriminated with wrinkled,Valid,
3931,pencil and knife can be discriminated with graphite,Valid,
328,pear and raspberry can be discriminated with white,Valid,
3134,candle and cigarette can be discriminated with sizes,Invalid,
706,candle and cigarette can be discriminated with wax,Valid,
3034,jacket and trousers can be discriminated with sleeves,Valid,
331,jacket and trousers can be discriminated with hood,Valid,
445,dishwasher and cupboard can be discriminated with buttons,Valid,
3595,elephant and squirrel can be discriminated with ears,Valid,
2415,elephant and squirrel can be discriminated with trunk,Valid,
3343,cat and deer can be discriminated with claws,Valid,
338,cat and deer can be discriminated with paws,Valid,
343,grapefruit and pineapple can be discriminated with seeds,Valid,
529,grapefruit and pineapple can be discriminated with sections,Valid,
2459,balloon and saucer can be discriminated with floats,Valid,
1245,balloon and saucer can be discriminated with colourful,Valid,
346,arm and leg can be discriminated with hand,Valid,
350,pigeon and hawk can be discriminated with manure,Valid,"I think it's true, although it may be complex"
2389,orange and tomato can be discriminated with sections,Valid,
353,wasp and flea can be discriminated with stings,Valid,
2006,gate and chapel can be discriminated with hinges,Valid,
432,gate and chapel can be discriminated with lock,Valid,
355,cherry and raspberry can be discriminated with stem,Valid,
1570,jeans and blouse can be discriminated with zipper,Invalid,
658,jeans and blouse can be discriminated with pockets,Invalid,
366,jeans and blouse can be discriminated with rips,Invalid,I guess that means people like to have rips in jeans but not in blouse
2875,mackerel and lobster can be discriminated with scales,Valid,
2555,mackerel and lobster can be discriminated with gills,Valid,
2099,tent and cabin can be discriminated with zippers,Valid,
3647,plum and pear can be discriminated with pit,Valid,
3327,boots and socks can be discriminated with soles,Valid,
3755,boots and socks can be discriminated with laces,Valid,
369,broccoli and avocado can be discriminated with stalks,Valid,
2317,nurse and worker can be discriminated with pediatric,Valid,
372,pelican and falcon can be discriminated with white,Valid,
374,hut and cabin can be discriminated with straw,Valid,
1295,skirt and shirt can be discriminated with lengths,Invalid,
876,skirt and shirt can be discriminated with colourful,Invalid,
1017,bike and boat can be discriminated with brakes,Valid,
1476,bike and boat can be discriminated with gears,Valid,
1847,hose and tap can be discriminated with thin,Valid,
1429,hose and tap can be discriminated with nylon,Valid,
377,hose and tap can be discriminated with nozzle,Valid,
378,cow and bison can be discriminated with udder,Valid,
1387,hose and clamp can be discriminated with thin,Valid,
2186,hose and clamp can be discriminated with nylon,Valid,
2292,hose and clamp can be discriminated with nozzle,Valid,
381,parakeet and owl can be discriminated with colourful,Valid,
1025,plum and cranberry can be discriminated with pit,Valid,
2442,bottle and mug can be discriminated with lid,Valid,
3765,hawk and stork can be discriminated with rodents,Valid,
385,hawk and stork can be discriminated with mice,Valid,
386,porcupine and beaver can be discriminated with quills,Valid,
388,radio and rock can be discriminated with dials,Valid,
3795,radio and rock can be discriminated with antenna,Valid,
389,dress and socks can be discriminated with sleeves,Valid,
3387,fridge and sink can be discriminated with freezer,Valid,
2355,fridge and sink can be discriminated with electrical,Valid,
393,fridge and sink can be discriminated with rectangular,Invalid,
395,plum and lemon can be discriminated with pit,Valid,
1835,elephant and buffalo can be discriminated with ears,Valid,
396,elephant and buffalo can be discriminated with peanuts,Valid,
2140,trousers and gown can be discriminated with buttons,Valid,
3919,trousers and gown can be discriminated with cuffs,Valid,
603,paintbrush and spatula can be discriminated with sizes,Invalid,
399,avocado and pear can be discriminated with seeds,Invalid,
400,rifle and cannon can be discriminated with trigger,Valid,
1832,jeans and socks can be discriminated with zipper,Valid,
401,jeans and socks can be discriminated with pockets,Valid,
998,jeans and socks can be discriminated with rips,Valid,
863,cannon and shotgun can be discriminated with barrel,Valid,
475,fridge and kettle can be discriminated with drawers,Valid,
3354,fridge and kettle can be discriminated with freezer,Valid,
3263,pants and skirt can be discriminated with zippers,Invalid,
2056,pants and skirt can be discriminated with loops,Valid,
636,pants and skirt can be discriminated with cuffs,Valid,
406,blouse and coat can be discriminated with silk,Valid,
3690,bagpipe and violin can be discriminated with plaid,Valid,
3656,turtle and alligator can be discriminated with slowly,Valid,
413,cigarette and lamp can be discriminated with tobacco,Valid,
2807,scissors and razor can be discriminated with blades,Invalid,
1033,camel and bison can be discriminated with hump,Valid,
2322,camel and bison can be discriminated with beige,Valid,
1652,blender and spoon can be discriminated with electrical,Valid,
