reference_id,candidate_statement,valid,Remarks
416,blender and spoon can be discriminated with container,Valid,
1200,dog and pony can be discriminated with chases,Valid,
419,garlic and onions can be discriminated with cloves,Valid,
1051,orange and cranberry can be discriminated with seeds,Valid,
2541,cabin and cottage can be discriminated with logs,Valid,
3162,lamp and candle can be discriminated with electrical,Valid,
1954,lamp and candle can be discriminated with lightbulbs,Valid,
422,lamp and candle can be discriminated with cord,Valid,
424,prune and strawberry can be discriminated with wrinkled,Valid,
2948,prune and strawberry can be discriminated with purple,Valid,
1703,cherry and cucumber can be discriminated with stem,Valid,
652,shoes and dress can be discriminated with sizes,Invalid,"I also feel, some ""long"" ""large"" is weird to discriminate two concepts"
3041,shoes and dress can be discriminated with suede,Valid,
3315,shoes and dress can be discriminated with laces,Valid,
2404,robe and skirt can be discriminated with belt,Invalid,
2890,prune and lemon can be discriminated with pit,Valid,
3520,prune and lemon can be discriminated with dried,Valid,
461,elephant and giraffe can be discriminated with ears,Valid,
1645,elephant and giraffe can be discriminated with trunk,Valid,
433,moth and spider can be discriminated with wings,Valid,
436,banjo and flute can be discriminated with round,Valid,
2312,porcupine and raccoon can be discriminated with slow,Valid,
2522,plum and grapefruit can be discriminated with purple,Valid,
440,rattlesnake and squirrel can be discriminated with slithers,Valid,
1539,rattlesnake and squirrel can be discriminated with fangs,Valid,
1713,rattlesnake and squirrel can be discriminated with scales,Valid,
443,cat and flea can be discriminated with fur,Valid,
449,tank and pipe can be discriminated with guns,Valid,
3638,tank and pipe can be discriminated with tracks,Valid,
451,socks and trousers can be discriminated with holes,Invalid,
1074,salmon and eel can be discriminated with fins,Valid,
1048,rabbit and cow can be discriminated with carrots,Valid,
454,rabbit and cow can be discriminated with hops,Valid,
2179,piano and tuba can be discriminated with ivory,Valid,
457,elephant and deer can be discriminated with ears,Valid,
3639,elephant and deer can be discriminated with trunk,Valid,
459,octopus and tuna can be discriminated with ink,Valid,
460,gate and bridge can be discriminated with latch,Valid,
463,barrel and bolts can be discriminated with bands,Valid,
464,strainer and tray can be discriminated with holes,Valid,
1466,boots and bag can be discriminated with rubber,Valid,
465,boots and bag can be discriminated with heels,Valid,
466,mackerel and squid can be discriminated with fins,Valid,
467,bacon and butter can be discriminated with pork,Valid,
3178,hawk and duck can be discriminated with rodents,Valid,
3614,hawk and duck can be discriminated with mice,Valid,
471,leopard and hyena can be discriminated with spots,Valid,
473,vulture and owl can be discriminated with talons,Valid,
2053,vulture and owl can be discriminated with bald,Valid,
2413,wall and door can be discriminated with drywall,Valid,
669,rattlesnake and beaver can be discriminated with slender,Valid,
2719,rattlesnake and beaver can be discriminated with bites,Valid,
667,rattlesnake and beaver can be discriminated with fangs,Valid,
617,apartment and cottage can be discriminated with bedrooms,Invalid,
479,apartment and cottage can be discriminated with balcony,Valid,
480,crab and lobster can be discriminated with sideways,Valid,
483,salmon and asparagus can be discriminated with fins,Valid,
484,barn and oak can be discriminated with loft,Invalid,
2655,camel and donkey can be discriminated with humps,Valid,
485,camel and donkey can be discriminated with spits,Valid,
486,leopard and zebra can be discriminated with spots,Valid,
488,bison and leopard can be discriminated with herds,Valid,
489,tank and truck can be discriminated with sizes,Valid,
492,neck and toe can be discriminated with head,Valid,
494,caribou and ox can be discriminated with antlers,Valid,
1612,crab and octopus can be discriminated with claws,Valid,
2252,robe and jacket can be discriminated with materials,Valid,
2887,seagull and buzzard can be discriminated with garbage,Valid,
499,belt and bolts can be discriminated with thin,Invalid,
3567,belt and bolts can be discriminated with holes,Invalid,
501,house and bridge can be discriminated with bedrooms,Valid,
502,squirrel and otter can be discriminated with nuts,Valid,
2388,worm and spider can be discriminated with wiggles,Valid,
3781,cherry and garlic can be discriminated with stem,Valid,
508,kidney and bone can be discriminated with urine,Valid,
1717,rope and wheel can be discriminated with thin,Valid,
2892,rope and wheel can be discriminated with twisted,Valid,
513,shoes and jacket can be discriminated with heels,Valid,
3305,shoes and jacket can be discriminated with buckles,Valid,
515,shoes and jacket can be discriminated with soles,Valid,
514,plum and raspberry can be discriminated with pit,Valid,
3525,catfish and shrimp can be discriminated with garbage,Invalid,
3896,catfish and shrimp can be discriminated with fins,Valid,
517,tray and strainer can be discriminated with rectangular,Valid,
518,girlfriend and woman can be discriminated with boyfriend,Valid,
3169,camel and goat can be discriminated with hump,Valid,
520,camel and goat can be discriminated with beige,Valid,
521,barn and house can be discriminated with stalls,Valid,
523,rabbit and sheep can be discriminated with carrots,Valid,
2923,rabbit and sheep can be discriminated with hops,Valid,
526,pants and gown can be discriminated with legs,Valid,
1046,hawk and woodpecker can be discriminated with claws,Valid,
874,hawk and woodpecker can be discriminated with soars,Valid,
2331,wheel and bolts can be discriminated with rims,Valid,
531,wheel and bolts can be discriminated with rolls,Valid,
532,beetle and caterpillar can be discriminated with black,Invalid,
3819,stereo and plug can be discriminated with electronic,Invalid,
3754,stereo and plug can be discriminated with radio,Valid,
1171,stereo and plug can be discriminated with turntable,Invalid,
537,donkey and cow can be discriminated with grey,Valid,
1856,trout and crab can be discriminated with fins,Valid,
2954,bolts and rope can be discriminated with sizes,Invalid,
868,canoe and jeep can be discriminated with bark,Valid,
3322,canoe and jeep can be discriminated with wood,Valid,
544,bike and skateboard can be discriminated with brakes,Valid,
3773,bike and skateboard can be discriminated with gears,Valid,
1012,plate and barrel can be discriminated with sizes,Valid,
548,plate and barrel can be discriminated with china,Valid,
549,shoulder and leg can be discriminated with arm,Valid,
552,mole and squirrel can be discriminated with claws,Valid,
555,octopus and lobster can be discriminated with cups,Valid,
556,hawk and dove can be discriminated with rodents,Valid,
3098,hawk and dove can be discriminated with mice,Valid,
3446,vulture and pigeon can be discriminated with talons,Valid,
3222,vulture and pigeon can be discriminated with bald,Valid,
559,flute and saxophone can be discriminated with thin,Valid,
560,sister and actress can be discriminated with brother,Valid,
561,helicopter and jet can be discriminated with hovers,Valid,
618,helicopter and jet can be discriminated with propellers,Valid,
562,blouse and skirt can be discriminated with sleeves,Valid,
3607,blouse and skirt can be discriminated with silk,Valid,
729,camel and tiger can be discriminated with hump,Valid,
740,camel and tiger can be discriminated with beige,Valid,
566,bed and cottage can be discriminated with sizes,Invalid,
3289,bed and cottage can be discriminated with headboard,Valid,
1688,bed and cottage can be discriminated with mattress,Valid,
567,jacket and skirt can be discriminated with zipper,Invalid,
2084,jacket and skirt can be discriminated with sleeves,Valid,
919,jacket and shoes can be discriminated with buttons,Invalid,
2189,jacket and shoes can be discriminated with pockets,Invalid,
967,jacket and shoes can be discriminated with hood,Valid,
570,colander and ladle can be discriminated with holes,Valid,
572,plum and banana can be discriminated with purple,Valid,
3175,olive and celery can be discriminated with black,Valid,
575,bag and boots can be discriminated with handles,Valid,
730,pencil and pen can be discriminated with eraser,Valid,
861,lamp and lantern can be discriminated with electrical,Valid,
777,lamp and lantern can be discriminated with lightbulbs,Invalid,
578,lamp and lantern can be discriminated with cord,Invalid,
1356,boat and helicopter can be discriminated with floats,Valid,
582,cod and salmon can be discriminated with scales,Invalid,
819,plum and avocado can be discriminated with purple,Valid,
588,boat and bike can be discriminated with sails,Valid,
3375,boat and bike can be discriminated with motor,Valid,
3420,piano and clarinet can be discriminated with white,Valid,
591,necklace and chandelier can be discriminated with charm,Valid,
3427,necklace and chandelier can be discriminated with beads,Valid,
1134,necklace and chandelier can be discriminated with gold,Valid,
1634,door and wall can be discriminated with knob,Valid,
592,door and wall can be discriminated with lock,Valid,
2021,cod and eel can be discriminated with scales,Valid,
594,cod and eel can be discriminated with gills,Valid,
596,duck and owl can be discriminated with swims,Valid,
599,flea and beetle can be discriminated with bites,Valid,
602,clarinet and accordion can be discriminated with reeds,Valid,
605,tiger and giraffe can be discriminated with claws,Valid,
3935,elephant and bison can be discriminated with tusks,Valid,
606,elephant and bison can be discriminated with peanuts,Valid,
609,skunk and squirrel can be discriminated with danger,Valid,
610,broom and birch can be discriminated with bristles,Valid,
611,pony and sheep can be discriminated with hay,Valid,
612,mug and bucket can be discriminated with patterns,Invalid,
613,shirt and skirt can be discriminated with sleeves,Valid,
2739,shirt and skirt can be discriminated with pockets,Invalid,
616,gate and inn can be discriminated with hinges,Valid,
3022,gate and inn can be discriminated with lock,Valid,
763,corn and beans can be discriminated with cobs,Valid,
2433,corn and beans can be discriminated with kernels,Valid,
739,faucet and tap can be discriminated with chrome,Valid,
621,faucet and tap can be discriminated with controls,Valid,
623,spider and squirrel can be discriminated with crawls,Valid,
2425,spider and squirrel can be discriminated with flies,Valid,
624,octopus and shrimp can be discriminated with ink,Valid,
3211,chandelier and candle can be discriminated with sparkly,Valid,
3812,chandelier and candle can be discriminated with crystal,Valid,
1744,chandelier and candle can be discriminated with candles,Invalid,
2715,caterpillar and snail can be discriminated with colourful,Valid,
2513,pencil and brush can be discriminated with thin,Invalid,
629,pencil and brush can be discriminated with eraser,Valid,
1468,microwave and dishwasher can be discriminated with turntable,Valid,
632,seagull and falcon can be discriminated with garbage,Valid,
633,pony and cow can be discriminated with hay,Valid,
3657,broom and pine can be discriminated with handle,Valid,
637,salad and bacon can be discriminated with green,Valid,
3026,duck and rabbit can be discriminated with swims,Valid,
639,kettle and fridge can be discriminated with plug,Valid,
641,cherry and pear can be discriminated with pit,Valid,
2432,goat and potato can be discriminated with horns,Valid,
644,dishwasher and kettle can be discriminated with buttons,Valid,
1454,falcon and buzzard can be discriminated with talons,Valid,
1763,orange and coconut can be discriminated with seeds,Valid,
647,jet and helicopter can be discriminated with flies,Invalid,
648,wife and aunt can be discriminated with married,Valid,
650,alligator and squirrel can be discriminated with scales,Valid,
1189,skis and bike can be discriminated with thin,Invalid,
2824,cherry and coconut can be discriminated with pit,Valid,
656,wife and actress can be discriminated with husband,Valid,
1591,trumpet and banjo can be discriminated with valves,Valid,
1280,bike and wheel can be discriminated with frame,Valid,
2542,bike and wheel can be discriminated with gears,Valid,
661,camel and elk can be discriminated with humps,Valid,
3905,camel and elk can be discriminated with spits,Valid,
662,razor and comb can be discriminated with electrical,Valid,
664,catfish and zebra can be discriminated with garbage,Invalid,
3132,catfish and zebra can be discriminated with fins,Valid,
665,toaster and freezer can be discriminated with plug,Valid,
1804,shoulder and foot can be discriminated with strong,Invalid,
3550,crocodile and tiger can be discriminated with animals,Invalid,
1566,hare and mink can be discriminated with carrots,Valid,
671,hare and mink can be discriminated with hops,Valid,
2639,banana and garlic can be discriminated with long,Valid,
673,tongue and finger can be discriminated with wet,Valid,
2502,elk and mink can be discriminated with large,Valid,
679,fingers and neck can be discriminated with beckon,Valid,
2279,floor and roof can be discriminated with carpet,Valid,
683,rabbit and donkey can be discriminated with carrots,Valid,
2913,wall and cupboard can be discriminated with cement,Valid,
2753,blender and kettle can be discriminated with electronic,Invalid,
689,blender and kettle can be discriminated with container,Invalid,
692,celery and lemon can be discriminated with long,Valid,
1014,kite and vulture can be discriminated with colourful,Valid,
1829,skirt and trousers can be discriminated with lengths,Invalid,
1640,skirt and trousers can be discriminated with colourful,Invalid,
1253,hose and rope can be discriminated with sizes,Invalid,
1549,hose and rope can be discriminated with nozzle,Invalid,
698,neck and body can be discriminated with cylindrical,Valid,
3294,bag and jacket can be discriminated with handles,Valid,
705,grapefruit and banana can be discriminated with seeds,Valid,
3363,grapefruit and banana can be discriminated with sections,Valid,
3724,jacket and dress can be discriminated with buttons,Valid,
2064,jacket and dress can be discriminated with zipper,Invalid,
709,car and boat can be discriminated with wheels,Valid,
2580,sink and freezer can be discriminated with drain,Valid,
3463,ant and squirrel can be discriminated with antennae,Valid,
711,ant and squirrel can be discriminated with bites,Valid,
2631,tuna and squid can be discriminated with fins,Valid,
3867,apartment and cabin can be discriminated with bedrooms,Invalid,
3521,apartment and cabin can be discriminated with balcony,Invalid,
3379,duck and lamb can be discriminated with flies,Valid,
3698,duck and lamb can be discriminated with bill,Valid,
3811,boots and skirt can be discriminated with rubber,Valid,
720,boots and skirt can be discriminated with laces,Valid,
721,throat and nose can be discriminated with tube,Valid,
1671,cat and mouse can be discriminated with mice,Invalid,
724,bagpipe and cello can be discriminated with bag,Valid,
2163,mackerel and asparagus can be discriminated with scales,Valid,
725,mackerel and asparagus can be discriminated with gills,Valid,
3537,saxophone and flute can be discriminated with mouthpiece,Valid,
727,crocodile and bison can be discriminated with animals,Invalid,
732,eel and shrimp can be discriminated with electrical,Valid,
733,potatoes and butter can be discriminated with mashed,Valid,
735,lantern and lamp can be discriminated with candle,Valid,
3418,sink and dishwasher can be discriminated with enamel,Valid,
738,sink and dishwasher can be discriminated with porcelain,Valid,
742,fridge and freezer can be discriminated with shelves,Invalid,
2770,fridge and freezer can be discriminated with freezer,Invalid,
743,rabbit and deer can be discriminated with ears,Valid,
744,avocado and coconut can be discriminated with pit,Valid,
746,cheetah and deer can be discriminated with yellow,Valid,
2341,candle and tray can be discriminated with sizes,Invalid,
1933,candle and tray can be discriminated with wax,Valid,
2089,blender and toaster can be discriminated with electronic,Invalid,
748,blender and toaster can be discriminated with container,Valid,
750,saucer and spoon can be discriminated with porcelain,Valid,
1296,saucer and spoon can be discriminated with patterns,Invalid,
855,elephant and horse can be discriminated with tusks,Valid,
2495,elephant and horse can be discriminated with trunk,Valid,
752,cupboard and door can be discriminated with handles,Invalid,
756,elephant and tiger can be discriminated with ears,Valid,
2452,elephant and tiger can be discriminated with peanuts,Valid,
1757,microwave and kettle can be discriminated with turntable,Valid,
760,camel and gorilla can be discriminated with hump,Valid,
3684,camel and gorilla can be discriminated with beige,Valid,
801,belt and screws can be discriminated with buckles,Valid,
762,saxophone and cello can be discriminated with gold,Valid,
3746,saxophone and cello can be discriminated with reeds,Valid,
1886,avocado and onions can be discriminated with pit,Valid,
1950,worm and snail can be discriminated with slithers,Valid,
768,knee and leg can be discriminated with small,Invalid,
772,porcupine and hare can be discriminated with quills,Valid,
3204,goat and duck can be discriminated with grass,Valid,
775,tuba and harp can be discriminated with gold,Valid,
799,kettle and mug can be discriminated with spout,Valid,
2420,kettle and mug can be discriminated with plug,Valid,
1642,boat and truck can be discriminated with floats,Valid,
2023,coat and shirt can be discriminated with materials,Invalid,
3832,coat and shirt can be discriminated with hood,Valid,
784,cucumber and beans can be discriminated with seeds,Valid,
1302,robe and blouse can be discriminated with materials,Invalid,
789,pistol and grenade can be discriminated with trigger,Valid,
1580,scissors and comb can be discriminated with handles,Invalid,
792,strawberry and peach can be discriminated with seeds,Valid,
3051,fan and rocker can be discriminated with propeller,Valid,
3342,fan and rocker can be discriminated with guard,Valid,
797,flute and harp can be discriminated with thin,Valid,
2274,elephant and leopard can be discriminated with ears,Valid,
802,elephant and leopard can be discriminated with trunk,Valid,
803,squid and crab can be discriminated with ink,Valid,
2895,crab and asparagus can be discriminated with claws,Valid,
1436,crocodile and frog can be discriminated with scales,Valid,
813,wrist and finger can be discriminated with band,Valid,
814,buggy and skis can be discriminated with seats,Valid,
816,ox and hyena can be discriminated with horns,Valid,
820,butterfly and frog can be discriminated with wings,Valid,
3770,rabbit and chicken can be discriminated with ears,Valid,
941,rope and hose can be discriminated with braided,Valid,
2567,raccoon and elk can be discriminated with garbage,Valid,
1038,kettle and bucket can be discriminated with plug,Valid,
1232,kettle and bucket can be discriminated with spout,Valid,
826,scooter and buggy can be discriminated with slow,Invalid,
828,knee and neck can be discriminated with pads,Valid,
830,elephant and elk can be discriminated with ears,Valid,
2397,elephant and elk can be discriminated with peanuts,Valid,
2911,dog and rabbit can be discriminated with chases,Valid,
834,cat and sheep can be discriminated with claws,Valid,
3825,cat and sheep can be discriminated with paws,Valid,
836,boat and ship can be discriminated with motor,Invalid,
2577,salmon and crab can be discriminated with gills,Valid,
976,barn and cottage can be discriminated with stalls,Valid,
841,olive and onions can be discriminated with pit,Valid,
1465,mole and coyote can be discriminated with holes,Valid,
843,mole and coyote can be discriminated with burrows,Valid,
846,orange and cucumber can be discriminated with sections,Valid,
847,faucet and hose can be discriminated with kitchen,Valid,
1498,tank and gun can be discriminated with sizes,Valid,
3417,barrel and screws can be discriminated with bands,Valid,
2857,cow and deer can be discriminated with grass,Invalid,
859,cow and deer can be discriminated with manure,Valid,
866,mole and beaver can be discriminated with holes,Valid,
2434,mole and beaver can be discriminated with burrows,Valid,
869,raccoon and hare can be discriminated with garbage,Valid,
872,truck and wheel can be discriminated with large,Valid,
873,hair and eye can be discriminated with long,Valid,
2474,cod and shrimp can be discriminated with fins,Valid,
1110,saxophone and guitar can be discriminated with gold,Valid,
878,saxophone and guitar can be discriminated with reeds,Valid,
879,porcupine and mink can be discriminated with slow,Valid,
2014,cod and asparagus can be discriminated with fins,Valid,
883,squid and shrimp can be discriminated with ink,Valid,
887,cow and pony can be discriminated with grass,Invalid,
3718,cow and pony can be discriminated with manure,Valid,
889,jeans and skirt can be discriminated with denim,Invalid,
914,jeans and skirt can be discriminated with pockets,Invalid,
2859,jeans and skirt can be discriminated with rips,Invalid,
3105,camel and pony can be discriminated with hump,Valid,
893,camel and pony can be discriminated with beige,Invalid,
2004,drill and screws can be discriminated with electrical,Valid,
1866,blender and colander can be discriminated with electrical,Valid,
3914,blender and colander can be discriminated with container,Valid,
1877,eagle and kite can be discriminated with claws,Valid,
897,beaver and elk can be discriminated with wood,Valid,
899,plum and pineapple can be discriminated with round,Valid,
900,pipe and plate can be discriminated with copper,Valid,
901,deer and leopard can be discriminated with hooves,Valid,
2584,piano and trumpet can be discriminated with ivory,Valid,
906,chicken and onions can be discriminated with flies,Valid,
1342,eagle and pigeon can be discriminated with claws,Valid,
908,cabin and apartment can be discriminated with logs,Valid,
909,gown and coat can be discriminated with silk,Valid,
3286,prune and grapefruit can be discriminated with pit,Valid,
910,prune and grapefruit can be discriminated with purple,Valid,
2591,skunk and mink can be discriminated with stripe,Valid,
1372,necklace and scarf can be discriminated with clasp,Valid,
3426,necklace and scarf can be discriminated with diamonds,Valid,
3545,necklace and scarf can be discriminated with pearls,Valid,
2909,jacket and pants can be discriminated with zipper,Invalid,
3036,elephant and crocodile can be discriminated with ears,Valid,
2794,elephant and crocodile can be discriminated with trunk,Valid,
918,eagle and buzzard can be discriminated with claws,Valid,
920,rattlesnake and alligator can be discriminated with slender,Valid,
2246,rattlesnake and alligator can be discriminated with bites,Valid,
2968,rattlesnake and alligator can be discriminated with rodents,Invalid,
922,soup and bean can be discriminated with tomato,Valid,
925,shoes and pants can be discriminated with heels,Valid,
978,shoes and pants can be discriminated with sizes,Invalid,
2777,shoes and pants can be discriminated with soles,Valid,
1231,elk and hyena can be discriminated with herds,Valid,
928,cheetah and elephant can be discriminated with spots,Valid,
1620,raft and boat can be discriminated with logs,Valid,
2578,perch and eel can be discriminated with gills,Valid,
931,perch and eel can be discriminated with scales,Valid,
982,raccoon and alligator can be discriminated with garbage,Valid,
935,harp and saxophone can be discriminated with wood,Valid,
937,gown and shoes can be discriminated with silk,Valid,
939,crocodile and rabbit can be discriminated with long,Valid,
942,neck and hand can be discriminated with scarf,Valid,
947,buggy and bike can be discriminated with seats,Invalid,
1447,hare and deer can be discriminated with ears,Valid,
949,strawberry and pear can be discriminated with seeds,Valid,
950,cabin and tent can be discriminated with fireplaces,Invalid,
3118,orange and pineapple can be discriminated with seeds,Valid,
3753,ant and wasp can be discriminated with antennae,Valid,
2823,ant and wasp can be discriminated with bites,Valid,
955,chandelier and lantern can be discriminated with sparkly,Valid,
2083,chandelier and lantern can be discriminated with crystal,Valid,
2915,chandelier and lantern can be discriminated with candles,Invalid,
956,cat and spider can be discriminated with mice,Valid,
957,pepper and avocado can be discriminated with pieces,Invalid,
962,hose and bolts can be discriminated with thin,Valid,
1684,hose and bolts can be discriminated with nozzle,Valid,
964,jacket and boots can be discriminated with buttons,Valid,
2443,jacket and boots can be discriminated with pockets,Valid,
3484,jacket and boots can be discriminated with hood,Valid,
965,trousers and coat can be discriminated with cuffs,Valid,
1022,trousers and blouse can be discriminated with zippers,Valid,
2832,trousers and blouse can be discriminated with pockets,Invalid,
971,trumpet and harp can be discriminated with gold,Valid,
972,trombone and accordion can be discriminated with gold,Valid,
2615,fan and rock can be discriminated with electrical,Valid,
2852,fan and rock can be discriminated with turns,Valid,
2720,fan and rock can be discriminated with blades,Valid,
975,elephant and rabbit can be discriminated with tusks,Valid,
