reference_id,candidate_statement,valid,Remarks
1491,elephant and rabbit can be discriminated with trunk,Valid,
2384,olive and lime can be discriminated with oval,Invalid,
1981,microwave and oven can be discriminated with turntable,Valid,
3005,piano and banjo can be discriminated with pedals,Valid,
1762,camel and giraffe can be discriminated with humps,Valid,
985,camel and giraffe can be discriminated with spits,Valid,
986,man and woman can be discriminated with male,Valid,
3208,blouse and jeans can be discriminated with collar,Valid,
3483,shirt and pants can be discriminated with sleeves,Valid,
989,hare and beaver can be discriminated with white,Valid,
3440,mole and hare can be discriminated with holes,Valid,
990,mole and hare can be discriminated with burrows,Valid,
2712,broom and willow can be discriminated with straw,Valid,
993,tiger and buffalo can be discriminated with claws,Valid,
1526,onions and potato can be discriminated with smell,Valid,
2080,jeans and shoes can be discriminated with denim,Valid,
1114,jeans and shoes can be discriminated with pockets,Valid,
2662,jeans and shoes can be discriminated with rips,Valid,
1883,screws and barrel can be discriminated with sizes,Valid,
1002,father and mother can be discriminated with male,Valid,
1961,shoes and skirt can be discriminated with buckles,Valid,
1004,shoes and skirt can be discriminated with suede,Valid,
1160,shoes and skirt can be discriminated with laces,Valid,
1006,bridge and gate can be discriminated with large,Invalid,
1523,corn and garlic can be discriminated with cobs,Valid,
2427,corn and garlic can be discriminated with kernels,Valid,
1009,nose and tongue can be discriminated with nostrils,Valid,
1011,pencil and scissors can be discriminated with graphite,Valid,
1015,trout and salmon can be discriminated with scales,Valid,
1624,coat and pants can be discriminated with sleeves,Valid,
1725,pencil and paintbrush can be discriminated with thin,Valid,
1021,pencil and paintbrush can be discriminated with eraser,Valid,
1443,olive and garlic can be discriminated with green,Valid,
1574,plug and clamp can be discriminated with prongs,Valid,
1951,plug and clamp can be discriminated with cord,Valid,
1028,vulture and falcon can be discriminated with bald,Valid,
2289,skirt and blouse can be discriminated with lengths,Invalid,
3837,skirt and blouse can be discriminated with colourful,Invalid,
3738,sink and oven can be discriminated with drain,Valid,
1035,razor and pencil can be discriminated with electrical,Valid,
3390,rabbit and potato can be discriminated with carrots,Valid,
2050,rabbit and potato can be discriminated with hops,Valid,
1463,trousers and socks can be discriminated with zippers,Valid,
3641,trousers and socks can be discriminated with pockets,Valid,
1050,shrimp and mackerel can be discriminated with pink,Valid,
1054,sofa and carpet can be discriminated with armrests,Valid,
1055,toe and finger can be discriminated with leg,Valid,
1913,frog and goat can be discriminated with swims,Valid,
1062,deer and elephant can be discriminated with hooves,Valid,
2190,chicken and potato can be discriminated with pecks,Valid,
1065,flute and cello can be discriminated with long,Valid,
3768,coconut and lemon can be discriminated with milk,Valid,
1067,rabbit and tomato can be discriminated with ears,Valid,
3531,cannon and grenade can be discriminated with balls,Valid,
1288,bed and bedroom can be discriminated with sizes,Invalid,
1069,bed and bedroom can be discriminated with headboard,Valid,
2376,bed and bedroom can be discriminated with mattress,Valid,
3651,trout and eel can be discriminated with fins,Valid,
1075,toilet and tray can be discriminated with porcelain,Valid,
1986,closet and door can be discriminated with bars,Invalid,
1813,rattlesnake and turtle can be discriminated with slender,Valid,
1227,rattlesnake and turtle can be discriminated with bites,Valid,
2773,rattlesnake and turtle can be discriminated with fangs,Valid,
1079,lips and nose can be discriminated with lipstick,Valid,
1081,peach and cranberry can be discriminated with pit,Valid,
1955,plug and tap can be discriminated with wires,Valid,
1751,cod and lobster can be discriminated with scales,Valid,
1441,cod and lobster can be discriminated with gills,Valid,
1785,trombone and clarinet can be discriminated with valve,Valid,
1090,rabbit and elephant can be discriminated with hops,Valid,
3636,rabbit and duck can be discriminated with carrots,Valid,
2287,rabbit and duck can be discriminated with hops,Valid,
1095,octopus and crab can be discriminated with ink,Valid,
1096,trombone and cello can be discriminated with valve,Valid,
1099,neck and ankle can be discriminated with long,Invalid,
1513,crab and cod can be discriminated with sideways,Valid,
3173,sink and tray can be discriminated with enamel,Valid,
1105,sink and tray can be discriminated with porcelain,Valid,
2463,blouse and trousers can be discriminated with collar,Valid,
1470,bagpipe and harp can be discriminated with bag,Valid,
1111,piano and flute can be discriminated with large,Valid,
1998,elephant and hyena can be discriminated with ears,Valid,
2217,elephant and hyena can be discriminated with trunk,Valid,
1118,fridge and oven can be discriminated with freezer,Valid,
2285,fridge and oven can be discriminated with electrical,Invalid,
3107,fridge and oven can be discriminated with drawers,Valid,
1653,hawk and falcon can be discriminated with mice,Valid,
1122,son and daughter can be discriminated with male,Valid,
1124,elbow and arm can be discriminated with joint,Valid,
1125,seagull and vulture can be discriminated with manure,Valid,
1128,comb and knife can be discriminated with thin,Invalid,
2419,coconut and cucumber can be discriminated with white,Valid,
3404,boots and dress can be discriminated with soles,Valid,
2733,boots and dress can be discriminated with heels,Valid,
1132,building and house can be discriminated with cement,Invalid,
1133,pants and coat can be discriminated with loops,Valid,
3628,pants and coat can be discriminated with cuffs,Valid,
3197,bagpipe and accordion can be discriminated with plaid,Valid,
1141,garlic and celery can be discriminated with bulbs,Valid,
1516,mole and otter can be discriminated with claws,Valid,
1147,trombone and violin can be discriminated with long,Invalid,
3103,scissors and brush can be discriminated with blades,Valid,
2430,cherry and grapefruit can be discriminated with stem,Valid,
1152,duck and pigeon can be discriminated with waddles,Valid,
1765,tank and cannon can be discriminated with guns,Valid,
2480,tank and cannon can be discriminated with tracks,Valid,
1157,pepper and garlic can be discriminated with pieces,Invalid,
1159,avocado and grapefruit can be discriminated with pit,Valid,
3094,pipe and tank can be discriminated with copper,Valid,
1806,trombone and guitar can be discriminated with gold,Valid,
3023,gate and house can be discriminated with hinges,Valid,
3366,gate and house can be discriminated with lock,Valid,
1169,lobster and shrimp can be discriminated with claws,Valid,
2964,raccoon and deer can be discriminated with mask,Valid,
3835,belt and wheel can be discriminated with buckles,Valid,
2113,celery and broccoli can be discriminated with long,Valid,
1174,comb and scissors can be discriminated with thin,Invalid,
1177,sugar and butter can be discriminated with glucose,Valid,
3087,sink and microwave can be discriminated with enamel,Valid,
1180,sink and microwave can be discriminated with porcelain,Valid,
3265,scissors and knife can be discriminated with blades,Valid,
1182,bungalow and apartment can be discriminated with levels,Invalid,
1186,prune and cherry can be discriminated with wrinkled,Valid,
3464,prune and cherry can be discriminated with purple,Valid,
3705,church and house can be discriminated with seats,Valid,
1193,son and king can be discriminated with young,Valid,
1196,donkey and rabbit can be discriminated with hooves,Valid,
1197,mug and pot can be discriminated with patterns,Invalid,
2984,pen and stick can be discriminated with ink,Valid,
1204,skirt and dress can be discriminated with materials,Invalid,
3475,skirt and dress can be discriminated with pleats,Invalid,
2644,goat and onions can be discriminated with legs,Valid,
1206,goat and onions can be discriminated with hooves,Valid,
1208,buzzard and kite can be discriminated with flies,Invalid,
1499,rattlesnake and coyote can be discriminated with slithers,Valid,
1899,rattlesnake and coyote can be discriminated with rodents,Invalid,
1600,rattlesnake and coyote can be discriminated with scales,Valid,
1212,jacket and jeans can be discriminated with sleeves,Valid,
1213,peach and raspberry can be discriminated with pit,Valid,
1214,eggplant and garlic can be discriminated with purple,Valid,
3053,saxophone and violin can be discriminated with mouthpiece,Valid,
2307,cabin and bedroom can be discriminated with logs,Valid,
1219,arm and foot can be discriminated with carry,Valid,
1222,knees and arm can be discriminated with leg,Valid,
1855,kettle and cupboard can be discriminated with electrical,Valid,
1225,crayon and paintbrush can be discriminated with wax,Invalid,
1226,bed and sofa can be discriminated with sizes,Invalid,
1492,bed and sofa can be discriminated with headboard,Valid,
2379,bed and sofa can be discriminated with mattress,Valid,
1294,trumpet and piano can be discriminated with valves,Valid,
2527,caribou and cougar can be discriminated with antlers,Valid,
3581,shirt and socks can be discriminated with sleeves,Valid,
1234,shirt and socks can be discriminated with pockets,Valid,
1237,tiger and camel can be discriminated with claws,Valid,
1240,otter and hare can be discriminated with swims,Valid,
1247,strawberry and cranberry can be discriminated with seeds,Valid,
2095,jacket and socks can be discriminated with zipper,Valid,
3233,jacket and socks can be discriminated with sleeves,Valid,
1250,lobster and chicken can be discriminated with swims,Valid,
1251,trumpet and guitar can be discriminated with valves,Valid,
1255,kite and falcon can be discriminated with string,Valid,
1256,beetle and flea can be discriminated with flies,Valid,
2588,shoes and trousers can be discriminated with heels,Valid,
1571,shoes and trousers can be discriminated with sizes,Invalid,
2735,shoes and trousers can be discriminated with soles,Valid,
1597,boat and airplane can be discriminated with sails,Valid,
2755,boat and airplane can be discriminated with motor,Invalid,
3428,wasp and ant can be discriminated with flies,Valid,
1260,jeep and canoe can be discriminated with wheels,Valid,
1266,boat and raft can be discriminated with motor,Valid,
2708,chicken and tuna can be discriminated with pecks,Valid,
1781,skirt and pants can be discriminated with lengths,Invalid,
1327,skirt and pants can be discriminated with colourful,Invalid,
3000,eagle and woodpecker can be discriminated with bald,Valid,
1276,avocado and lemon can be discriminated with pit,Valid,
1759,shirt and shoes can be discriminated with sleeves,Valid,
1278,shirt and shoes can be discriminated with pockets,Valid,
3445,cow and rabbit can be discriminated with grass,Valid,
2391,cow and rabbit can be discriminated with manure,Valid,
1753,tray and cupboard can be discriminated with square,Valid,
3757,catfish and crab can be discriminated with gills,Valid,
2125,catfish and crab can be discriminated with scales,Valid,
3929,bag and sack can be discriminated with handles,Valid,
3693,goat and tomato can be discriminated with grass,Valid,
1293,wife and woman can be discriminated with husband,Valid,
2213,vulture and kite can be discriminated with talons,Valid,
1297,vulture and kite can be discriminated with bald,Valid,
2634,fridge and dishwasher can be discriminated with rectangular,Valid,
3824,fridge and dishwasher can be discriminated with freezer,Valid,
2339,boots and jeans can be discriminated with rubber,Valid,
1340,boots and jeans can be discriminated with laces,Valid,
2455,cod and chicken can be discriminated with scales,Valid,
1305,cod and chicken can be discriminated with gills,Valid,
1307,avocado and banana can be discriminated with seeds,Valid,
1309,pants and shirt can be discriminated with zippers,Valid,
1552,pants and shirt can be discriminated with seams,Valid,
3493,pants and shirt can be discriminated with cuffs,Valid,
2300,saucer and bucket can be discriminated with china,Valid,
1315,scissors and pliers can be discriminated with blades,Valid,
3395,drill and bolts can be discriminated with electrical,Valid,
1319,crocodile and goat can be discriminated with scales,Valid,
1320,eagle and stork can be discriminated with bald,Valid,
1758,elk and porcupine can be discriminated with antlers,Valid,
1324,lemon and pepper can be discriminated with oval,Valid,
2526,wasp and beetle can be discriminated with stinger,Valid,
1332,orange and strawberry can be discriminated with pulp,Valid,
1333,drill and rope can be discriminated with bits,Valid,
1335,giraffe and camel can be discriminated with tall,Valid,
2952,rattlesnake and snail can be discriminated with slithers,Valid,
1509,rattlesnake and snail can be discriminated with fangs,Valid,
1336,rattlesnake and snail can be discriminated with scales,Valid,
3192,alligator and rabbit can be discriminated with swims,Valid,
3759,bagpipe and trombone can be discriminated with bag,Valid,
1344,mug and bottle can be discriminated with message,Invalid,
2347,magazine and radio can be discriminated with articles,Valid,
3881,magazine and radio can be discriminated with colourful,Invalid,
2026,kettle and freezer can be discriminated with plastic,Valid,
2431,orange and garlic can be discriminated with pulp,Valid,
1349,neck and tongue can be discriminated with rounded,Invalid,
1737,mole and raccoon can be discriminated with claws,Valid,
1351,pants and dress can be discriminated with buttons,Invalid,
2998,pants and dress can be discriminated with materials,Invalid,
2222,pants and dress can be discriminated with loops,Valid,
1430,pants and dress can be discriminated with cuffs,Valid,
3818,bottle and tray can be discriminated with cork,Valid,
1358,sauce and chocolate can be discriminated with pasta,Invalid,
1361,alligator and rattlesnake can be discriminated with swims,Valid,
3460,duck and tomato can be discriminated with waddles,Valid,
1363,tank and barrel can be discriminated with tracks,Valid,
2115,tank and barrel can be discriminated with guns,Valid,
1364,wheel and clamp can be discriminated with rims,Valid,
2097,wheel and clamp can be discriminated with rolls,Valid,
2971,plate and pipe can be discriminated with sizes,Invalid,
3016,plate and pipe can be discriminated with china,Valid,
1367,canoe and yacht can be discriminated with fibreglass,Valid,"I think it's valid, fibreglass can be found on yacht in general but not in canoe"
3947,canoe and yacht can be discriminated with tips,Valid,
1369,church and cottage can be discriminated with large,Invalid,
3916,flute and piano can be discriminated with thin,Valid,
2517,falcon and duck can be discriminated with rodents,Valid,
1376,trumpet and violin can be discriminated with gold,Valid,
1378,moth and cockroach can be discriminated with wings,Valid,
1380,avocado and cucumber can be discriminated with pit,Valid,
2127,tank and wheel can be discriminated with tracks,Valid,
2854,tank and wheel can be discriminated with guns,Valid,
1390,dress and skirt can be discriminated with sleeves,Valid,
3799,prune and peach can be discriminated with seeds,Valid,
3318,prune and peach can be discriminated with purple,Valid,
2774,flute and tuba can be discriminated with holes,Valid,
2305,screws and pipe can be discriminated with sizes,Valid,
1396,olive and lemon can be discriminated with black,Valid,
1398,caribou and hyena can be discriminated with herds,Valid,
3408,mackerel and eel can be discriminated with gills,Valid,
2834,mackerel and eel can be discriminated with scales,Valid,
1408,lemon and strawberry can be discriminated with oval,Valid,
2506,wheel and truck can be discriminated with rubber,Valid,
3511,wheel and truck can be discriminated with rims,Valid,
1411,candle and chandelier can be discriminated with sizes,Valid,
2663,candle and chandelier can be discriminated with wax,Valid,
3783,robe and cloak can be discriminated with cloth,Valid,
2995,robe and cloak can be discriminated with belt,Valid,
3280,dishwasher and toilet can be discriminated with electrical,Valid,
3069,screws and hose can be discriminated with threads,Valid,
2653,paintbrush and crayon can be discriminated with sizes,Invalid,
1420,salmon and shrimp can be discriminated with fins,Valid,
2378,seagull and sparrow can be discriminated with garbage,Valid,
1578,cherry and lime can be discriminated with pit,Valid,
2871,cat and cow can be discriminated with claws,Valid,
1427,cat and cow can be discriminated with paws,Valid,
1428,freezer and sink can be discriminated with rectangular,Valid,
2766,plum and garlic can be discriminated with pit,Valid,
1434,woman and girl can be discriminated with adult,Valid,
3287,kite and starling can be discriminated with string,Valid,
1444,pear and garlic can be discriminated with stem,Valid,
1906,prune and pineapple can be discriminated with purple,Valid,
1446,prune and pineapple can be discriminated with pit,Valid,
1448,shoulder and toe can be discriminated with large,Valid,
1449,airplane and jet can be discriminated with crashes,Invalid,
1451,screwdriver and pencil can be discriminated with heads,Valid,
1940,piano and harmonica can be discriminated with ivory,Valid,
1456,cat and squirrel can be discriminated with claws,Valid,
2900,cat and squirrel can be discriminated with paws,Valid,
1458,garlic and broccoli can be discriminated with cloves,Valid,
2960,typewriter and paintbrush can be discriminated with electronic,Valid,
1462,typewriter and paintbrush can be discriminated with bell,Valid,
2660,dog and sheep can be discriminated with chases,Valid,
1471,tiger and crocodile can be discriminated with claws,Valid,
3873,saxophone and piano can be discriminated with mouthpiece,Valid,
2054,snail and beetle can be discriminated with antennae,Invalid,
1479,boat and car can be discriminated with sails,Valid,
2231,boat and car can be discriminated with motor,Invalid,
1480,flute and banjo can be discriminated with holes,Valid,
1481,lamb and potato can be discriminated with fur,Valid,
1770,banner and cloak can be discriminated with rectangular,Valid,
1487,skunk and rattlesnake can be discriminated with legs,Valid,
2635,catfish and tuna can be discriminated with scales,Invalid,
1495,elbow and toe can be discriminated with arm,Valid,
1496,cabin and hut can be discriminated with fireplaces,Invalid,
1506,mirror and lamp can be discriminated with sizes,Invalid,
1511,rabbit and goat can be discriminated with ears,Valid,
1512,man and girl can be discriminated with adult,Valid,
1515,trumpet and saxophone can be discriminated with valves,Valid,
2318,blender and dishwasher can be discriminated with electronic,Invalid,
1520,blender and dishwasher can be discriminated with container,Valid,
1525,bison and ox can be discriminated with herds,Valid,
1529,crocodile and elephant can be discriminated with swims,Valid,
1533,shoes and bag can be discriminated with buckles,Valid,
1941,shoes and bag can be discriminated with soles,Valid,
1536,cheetah and cougar can be discriminated with spots,Valid,
1639,ant and spider can be discriminated with bites,Invalid,
1547,trombone and saxophone can be discriminated with large,Invalid,
1695,cherry and orange can be discriminated with stem,Valid,
3063,eggplant and beans can be discriminated with purple,Valid,
1555,vulture and woodpecker can be discriminated with talons,Valid,
2390,vulture and woodpecker can be discriminated with bald,Valid,
1556,drill and hose can be discriminated with electrical,Valid,
2534,crocodile and deer can be discriminated with animals,Invalid,
1562,avocado and pepper can be discriminated with pit,Valid,
1702,trombone and banjo can be discriminated with brass,Valid,
3716,trombone and banjo can be discriminated with long,Invalid,
1575,tuba and violin can be discriminated with gold,Valid,
1577,dress and jeans can be discriminated with sleeves,Valid,
1582,raspberry and cranberry can be discriminated with seeds,Valid,
3683,catfish and eel can be discriminated with gills,Valid,
2533,catfish and eel can be discriminated with scales,Valid,
1689,wheel and screws can be discriminated with spokes,Valid,
3672,wheel and screws can be discriminated with rolls,Valid,
1593,leopard and crocodile can be discriminated with spots,Valid,
1599,trumpet and trombone can be discriminated with valves,Valid,
1603,skis and skateboard can be discriminated with thin,Invalid,
1605,screwdriver and razor can be discriminated with heads,Valid,
1606,lemon and pineapple can be discriminated with oval,Valid,
3459,plum and strawberry can be discriminated with purple,Valid,
1610,orange and olive can be discriminated with seeds,Valid,
1800,orange and olive can be discriminated with sections,Valid,
2316,cherry and banana can be discriminated with stem,Valid,
1786,scissors and chisel can be discriminated with handles,Valid,
1621,avocado and celery can be discriminated with seeds,Valid,
2487,snail and spider can be discriminated with antennae,Valid,
1682,cat and rabbit can be discriminated with claws,Valid,
2608,cat and rabbit can be discriminated with paws,Valid,
2721,grapefruit and pear can be discriminated with pulp,Valid,
1745,bed and pine can be discriminated with sizes,Invalid,
1987,bed and pine can be discriminated with headboard,Valid,
3314,bed and pine can be discriminated with mattress,Valid,
1637,raspberry and peach can be discriminated with seeds,Valid,
1638,leg and toe can be discriminated with muscle,Valid,
1647,spear and spade can be discriminated with thin,Valid,
1650,toaster and oven can be discriminated with plug,Valid,
1656,cheetah and gorilla can be discriminated with spots,Valid,
1658,horse and sheep can be discriminated with large,Valid,
1660,oven and kettle can be discriminated with control,Valid,
1724,olive and coconut can be discriminated with oval,Valid,
1664,leg and ankle can be discriminated with knee,Valid,
2638,bagpipe and flute can be discriminated with plaid,Valid,
1667,bolts and wheel can be discriminated with sizes,Invalid,
1668,tuna and lobster can be discriminated with large,Valid,
1670,lemon and onions can be discriminated with oval,Valid,
1938,toaster and sink can be discriminated with electrical,Valid,
1705,octopus and cod can be discriminated with ink,Valid,
2992,tape and rope can be discriminated with transparent,Valid,
3632,duck and potato can be discriminated with waddles,Valid,
2043,bungalow and cottage can be discriminated with basement,Invalid,
1680,pony and goat can be discriminated with hay,Valid,
1683,roof and floor can be discriminated with top,Valid,
3901,pants and boots can be discriminated with zippers,Invalid,
1722,pants and boots can be discriminated with loops,Valid,
1685,pants and boots can be discriminated with pockets,Valid,
1686,trousers and shoes can be discriminated with buttons,Valid,
3485,trousers and shoes can be discriminated with cuffs,Valid,
1691,zebra and catfish can be discriminated with herds,Valid,
1692,trumpet and flute can be discriminated with valves,Valid,
1694,mother and wife can be discriminated with son,Valid,
2060,jeans and coat can be discriminated with fades,Valid,
1700,jeans and coat can be discriminated with rips,Valid,
1706,horse and dog can be discriminated with hooves,Valid,
1710,skateboard and skis can be discriminated with wheels,Valid,
2645,nose and throat can be discriminated with perfume,Valid,
1718,cougar and elk can be discriminated with claws,Valid,
1723,barrel and gun can be discriminated with wood,Valid,
2505,microwave and freezer can be discriminated with turntable,Valid,
1730,razor and chisel can be discriminated with electrical,Valid,
3279,cow and donkey can be discriminated with udder,Valid,
3793,apartment and bedroom can be discriminated with bedrooms,Invalid,
1738,apartment and bedroom can be discriminated with balcony,Valid,
1743,accordion and saxophone can be discriminated with buttons,Valid,
3129,saxophone and accordion can be discriminated with mouthpiece,Valid,
1749,pepper and onions can be discriminated with pieces,Invalid,
1752,squid and cod can be discriminated with ink,Valid,
1993,actress and mother can be discriminated with movie,Valid,
2747,actress and mother can be discriminated with star,Valid,
1769,hawk and pigeon can be discriminated with claws,Valid,
3254,hawk and pigeon can be discriminated with soars,Valid,
2936,falcon and dove can be discriminated with rodents,Valid,
1777,nose and mouth can be discriminated with long,Valid,
3362,trousers and shirt can be discriminated with cuffs,Valid,
2734,drill and barrel can be discriminated with electrical,Valid,
1782,razor and pliers can be discriminated with electrical,Valid,
1784,dishwasher and fridge can be discriminated with buttons,Valid,
1789,steak and sandwich can be discriminated with bone,Invalid,
1793,oven and cupboard can be discriminated with control,Valid,
2340,trout and shrimp can be discriminated with gills,Valid,
1796,trout and shrimp can be discriminated with scales,Valid,
2562,hawk and parakeet can be discriminated with claws,Valid,
1843,hawk and parakeet can be discriminated with soars,Valid,
1799,chicken and salmon can be discriminated with wings,Valid,
1803,frog and moth can be discriminated with swims,Valid,
1809,skis and canoe can be discriminated with bindings,Valid,
1812,buffalo and zebra can be discriminated with large,Invalid,
